{
  "format": "open-values-presentation-package",
  "version": "1.0.0",
  "built": "2026-07-20",
  "consumer": "P5 presentation implementation",
  "sources": [
    "content/ontology.json",
    "content/presentation/strings.json",
    "content/presentation/page-kinds.json",
    "content/presentation/fixtures.json",
    "content/presentation/sources.json"
  ],
  "taxonomy": {
    "source": "content/ontology.json",
    "sourceSchema": "app/data/standard/schemas/ontology.schema.json",
    "generatedSource": "app/data/index.json#/ontology/presentation",
    "version": 1,
    "levels": [
      {
        "id": "need",
        "label": "Need"
      },
      {
        "id": "category",
        "label": "Category"
      },
      {
        "id": "subcategory",
        "label": "Subcategory"
      },
      {
        "id": "decision",
        "label": "Decision"
      },
      {
        "id": "entry",
        "label": "Entry"
      }
    ],
    "leafState": {
      "liveWhen": "cid is present",
      "gapWhen": "cid is absent",
      "gapLabel": "Not yet covered",
      "gapIdRule": "Kebab-case the source-row label; fail the build if two gap labels produce the same id."
    },
    "counts": {
      "needs": 8,
      "categories": 18,
      "subcategories": 39,
      "decisions": 219,
      "livePaths": 134,
      "liveDatasets": 130,
      "notYetCovered": 85
    },
    "needs": [
      {
        "id": "nourish",
        "label": "NOURISH",
        "reads": "Food and drink for ordinary meals, shared tables, and the days in between.",
        "categories": [
          {
            "id": "everyday-food",
            "label": "Everyday food",
            "reads": "Breakfast, staples, ingredients, and the foods that make a meal.",
            "subcategories": [
              {
                "id": "breakfast-and-bread",
                "label": "Breakfast and bread",
                "decisionIds": [
                  "breakfast-cereal",
                  "granola",
                  "oats",
                  "bread"
                ]
              },
              {
                "id": "dairy-and-alternatives",
                "label": "Dairy and alternatives",
                "decisionIds": [
                  "plant-based-milk",
                  "milk",
                  "plant-based-yogurt",
                  "eggs",
                  "yogurt",
                  "cheese",
                  "butter"
                ]
              },
              {
                "id": "protein-and-meals",
                "label": "Protein and meals",
                "decisionIds": [
                  "plant-based-meat",
                  "tofu",
                  "hummus",
                  "frozen-pizza",
                  "ready-meals",
                  "meat-and-poultry",
                  "fish-seafood"
                ]
              },
              {
                "id": "pantry-and-cooking",
                "label": "Pantry and cooking",
                "decisionIds": [
                  "olive-oil",
                  "pasta-sauce",
                  "rice",
                  "pasta",
                  "legumes",
                  "soups",
                  "canned-fish",
                  "canned-tomatoes",
                  "canned-vegetables",
                  "frozen-vegetables",
                  "pantry-staples",
                  "flour-baking",
                  "spices-seasoning"
                ]
              }
            ]
          },
          {
            "id": "drinks",
            "label": "Drinks",
            "reads": "Everyday drinks and the alcoholic drinks not yet compared here.",
            "subcategories": [
              {
                "id": "drinks-all",
                "label": "Drinks",
                "decisionIds": [
                  "coffee",
                  "tea",
                  "fruit-juice",
                  "soda",
                  "energy-drinks",
                  "bottled-water",
                  "wine",
                  "beer",
                  "spirits"
                ]
              }
            ]
          },
          {
            "id": "snacks-and-extras",
            "label": "Snacks and extras",
            "reads": "Snacks, sweets, spreads, and condiments used around a meal.",
            "subcategories": [
              {
                "id": "snacks-and-sweets",
                "label": "Snacks and sweets",
                "decisionIds": [
                  "dark-chocolate",
                  "nuts",
                  "ice-cream",
                  "crisps",
                  "biscuits",
                  "dried-fruit",
                  "cereal-bars",
                  "crackers"
                ]
              },
              {
                "id": "spreads-and-condiments",
                "label": "Spreads and condiments",
                "decisionIds": [
                  "nut-butter",
                  "honey",
                  "fruit-jam",
                  "chocolate-spread",
                  "ketchup",
                  "mayonnaise",
                  "salad-dressing",
                  "pickles"
                ]
              }
            ]
          }
        ]
      },
      {
        "id": "care",
        "label": "CARE",
        "reads": "What touches bodies, clothing, children, pets, and everyday wellbeing.",
        "categories": [
          {
            "id": "body-care",
            "label": "Body care",
            "reads": "Products used on skin, hair, teeth, and the body.",
            "subcategories": [
              {
                "id": "bath-and-body",
                "label": "Bath and body",
                "decisionIds": [
                  "soap",
                  "body-wash",
                  "deodorant"
                ]
              },
              {
                "id": "skin-and-cosmetics",
                "label": "Skin and cosmetics",
                "decisionIds": [
                  "sunscreen",
                  "face-wash",
                  "face-cream",
                  "hand-cream",
                  "lip-balm",
                  "skincare",
                  "make-up-and-cosmetics",
                  "nail-care",
                  "fragrance"
                ]
              },
              {
                "id": "hair-and-grooming",
                "label": "Hair and grooming",
                "decisionIds": [
                  "shampoo",
                  "hair-conditioner",
                  "razors",
                  "period-products",
                  "menstrual-cups-and-discs",
                  "hair-styling"
                ]
              },
              {
                "id": "oral-care",
                "label": "Oral care",
                "decisionIds": [
                  "toothpaste",
                  "mouthwash",
                  "electric-toothbrushes",
                  "glasses-and-contact-lenses"
                ]
              }
            ]
          },
          {
            "id": "health-and-wellbeing",
            "label": "Health and wellbeing",
            "reads": "Everyday health, fitness, sleep, and reproductive care.",
            "subcategories": [
              {
                "id": "remedies-and-health",
                "label": "Remedies and health",
                "decisionIds": [
                  "vitamins-and-supplements",
                  "over-the-counter-medicine",
                  "first-aid",
                  "contraception"
                ]
              },
              {
                "id": "mind-and-movement",
                "label": "Mind and movement",
                "decisionIds": [
                  "fitness-equipment",
                  "sports-nutrition",
                  "mental-health-apps",
                  "meditation-apps"
                ]
              }
            ]
          },
          {
            "id": "clothes-family-and-pets",
            "label": "Clothes, family, and pets",
            "reads": "Clothing, repair, children's needs, and care for animals at home.",
            "subcategories": [
              {
                "id": "clothing-and-repair",
                "label": "Clothing and repair",
                "decisionIds": [
                  "clothing",
                  "outerwear-and-coats",
                  "underwear-and-socks",
                  "jewellery-and-watches",
                  "secondhand-and-resale",
                  "repair-and-tailoring"
                ]
              },
              {
                "id": "children-and-pets",
                "label": "Children and pets",
                "decisionIds": [
                  "nappies",
                  "baby-food-and-formula",
                  "baby-wipes",
                  "car-seats",
                  "strollers-and-pushchairs",
                  "reusable-nappies",
                  "toys",
                  "kids-clothing",
                  "childcare",
                  "dog-food",
                  "cat-food",
                  "pet-supplies",
                  "flea-and-worming",
                  "pet-insurance",
                  "vet-services",
                  "adoption-and-rescue"
                ]
              }
            ]
          }
        ]
      },
      {
        "id": "keep-a-home",
        "label": "KEEP A HOME",
        "reads": "Cleaning, energy, water, tools, and the things that make a place work.",
        "categories": [
          {
            "id": "cleaning-and-kitchen",
            "label": "Cleaning and kitchen",
            "reads": "Cleaning, household supplies, cooking, storage, and water at home.",
            "subcategories": [
              {
                "id": "cleaning-and-household-supplies",
                "label": "Cleaning and household supplies",
                "decisionIds": [
                  "cleaning-products",
                  "laundry",